{
  "schema_version": 1,
  "coded_id": "EXAMPLE_CODE",
  "visit_id": "00000000000000000000000000000000",
  "profile_order": [
    "P1",
    "P2",
    "P3"
  ],
  "examples": {
    "P1": {
      "file": "calibration-P1.wav",
      "file_sha256": "f5a1a6d526bb5685e8a26217c5313e0afd18c3824c9adee8643fe99e2af8bd90",
      "pcm_sha256": "e50e47627a73137392e2cfdd0dac2253adda3c8b10aea49174c9506c3fb90211"
    },
    "P2": {
      "file": "calibration-P2.wav",
      "file_sha256": "94c4aa228c33f3f57b78bb5c10ccc86a00e85efe5d59fa0c7e8ac09d2d2bb19a",
      "pcm_sha256": "5c1cf02801d36137df047975043a89613aff99882eca77f3604579a2e223dca8"
    },
    "P3": {
      "file": "calibration-P3.wav",
      "file_sha256": "0645d88eabf758f4e53645119538f703dc1ae641771655e900e1b9089f1787fd",
      "pcm_sha256": "14299502afa920cc0413def79b289f0258dcea794bf4922a0666ad34186ea2b1"
    }
  },
  "preload_budget_bytes": 4194304,
  "engineering_desktop_preview": false
}
